{
  "$schema": "https://lingity.dev/schemas/v1/profile.schema.json",
  "name": "architecture-review",
  "version": "1.4.0",
  "language": "en",
  "rewrite_policy": {
    "max_readable_word_growth_percent": 10,
    "max_readable_word_growth_absolute": 12,
    "prefer_shorter_candidate": true
  },
  "weights": {
    "sentence_load": 25,
    "morphology": 20,
    "agency": 20,
    "lexical_clarity": 15,
    "structure": 10,
    "redundancy": 10
  },
  "bands": [
    {
      "name": "revision_required",
      "minimum": 0,
      "maximum": 69.99
    },
    {
      "name": "usable_but_improvable",
      "minimum": 70,
      "maximum": 84.99
    },
    {
      "name": "clear",
      "minimum": 85,
      "maximum": 100
    }
  ],
  "thresholds": {
    "max_sentence_words": 25,
    "max_actions_per_sentence": 3,
    "max_clauses_per_sentence": 3,
    "max_nominalizations_per_sentence": 2,
    "noun_stack_words": 3,
    "max_paragraph_words": 90,
    "max_repeated_content_word": 2,
    "max_punctuation_depth": 4,
    "max_undefined_acronyms_per_sentence": 2,
    "max_undefined_acronyms_per_paragraph": 4,
    "max_inline_list_items": 4,
    "max_sentence_purposes": 2,
    "max_qualifiers_per_sentence": 2,
    "max_compound_parts": 3,
    "max_duplicate_framing_block_distance": 16,
    "max_duplicate_framing_words": 30,
    "min_duplicate_framing_shared_terms": 4,
    "min_duplicate_framing_similarity": 0.5
  },
  "rules": {
    "abstract_evidence_heads": [
      "evidence",
      "attestation",
      "assurance",
      "artifact",
      "artefact"
    ],
    "nominalization_suffixes": [
      "tion",
      "sion",
      "ment",
      "ance",
      "ence",
      "ency",
      "ship",
      "ure",
      "age"
    ],
    "nominalization_exclusions": [
      "agreement",
      "architecture",
      "argument",
      "critical",
      "document",
      "element",
      "evidence",
      "final",
      "implement",
      "instrument",
      "management",
      "operational",
      "quality",
      "requirement",
      "several",
      "statement",
      "system"
    ],
    "nominalizations": [
      "approval",
      "assessment",
      "authorization",
      "classification",
      "closure",
      "configuration",
      "decision",
      "deployment",
      "documentation",
      "governance",
      "implementation",
      "migration",
      "mitigation",
      "observation",
      "operation",
      "ratification",
      "recommendation",
      "remediation",
      "resilience",
      "resolution",
      "testing",
      "validation",
      "verification"
    ],
    "hidden_agency": {
      "agentless decision": [
        "decision should be make",
        "decision should be take",
        "decision should be finalize",
        "decision should be approve",
        "approval should be complete",
        "ratification should be complete",
        "validation should be confirm",
        "verification should be confirm"
      ],
      "impersonal recommendation": [
        "it be recommend that",
        "it be require that",
        "it be expect that",
        "it be request that"
      ],
      "agentless requirement": [
        "must be approve",
        "should be approve",
        "need to be approve",
        "must be build",
        "should be build",
        "must be complete",
        "should be complete",
        "must be document",
        "should be document",
        "must be implement",
        "should be implement",
        "must be provide",
        "should be provide",
        "must be resolve",
        "should be resolve",
        "must be review",
        "should be review",
        "must be validate",
        "should be validate",
        "must be verify",
        "should be verify",
        "require closure evidence"
      ],
      "indirect recommendation": [
        "propose defer",
        "recommend defer"
      ],
      "indirect decision": [
        "return for human decision",
        "returns for human decision"
      ]
    },
    "weak_verbs": {
      "light verb carry out": [
        "carry out"
      ],
      "light verb make decision": [
        "make decision"
      ],
      "light verb perform conduct": [
        "perform assessment",
        "perform analysis",
        "perform evaluation",
        "perform investigation",
        "perform review",
        "perform test",
        "perform testing",
        "conduct assessment",
        "conduct analysis",
        "conduct evaluation",
        "conduct investigation",
        "conduct review",
        "conduct test",
        "conduct testing"
      ],
      "proposal chain": [
        "propose defer",
        "recommend defer"
      ]
    },
    "jargon": {
      "architecture jargon": [
        "eventual consistency",
        "blast radius",
        "single pane of glass",
        "north star architecture",
        "north star design",
        "north star state"
      ],
      "machine-made compound": [
        "current state baseline",
        "current state architecture",
        "current state topology",
        "future state baseline",
        "future state architecture",
        "future state topology"
      ]
    },
    "bureaucratic_phrases": {
      "impersonal recommendation": [
        "it be recommend that",
        "it should be note that"
      ],
      "temporal filler": [
        "go forward",
        "at this time"
      ],
      "wordy connector": [
        "in order to",
        "as appropriate"
      ],
      "recommend recommending": [
        "recommend decision propose"
      ],
      "artificial return phrase": [
        "return for human decision",
        "returns for human decision"
      ],
      "provisional baseline phrase": [
        "provisional current state baseline"
      ]
    },
    "protected_concepts": [],
    "actor_terms": [
      "architect",
      "architects",
      "component",
      "components",
      "gateway",
      "group",
      "operator",
      "operators",
      "owner",
      "owners",
      "platform",
      "reviewer",
      "reviewers",
      "service",
      "services",
      "sponsor",
      "sponsors",
      "system",
      "systems",
      "team",
      "teams"
    ],
    "indirect_predicates": {
      "expletive there": [
        "there be need",
        "there be requirement",
        "there be risk",
        "there be gap",
        "there be issue",
        "there be concern"
      ],
      "expletive it": [
        "it be important that",
        "it be necessary that",
        "it be critical that",
        "it be clear that",
        "it be unclear that",
        "it be possible that",
        "it be expect that"
      ],
      "purpose wrapper": [
        "purpose of",
        "goal of",
        "objective of",
        "intent of"
      ]
    },
    "allowed_compounds": [
      "cost-effective",
      "evidence-based",
      "long-term",
      "near-term",
      "owner-approved",
      "read-only",
      "region-aware",
      "risk-based",
      "short-term",
      "well-known"
    ],
    "compound_modifier_suffixes": [
      "adjusted",
      "aligned",
      "derived",
      "driven",
      "enabled",
      "evidenced",
      "oriented",
      "sourced"
    ],
    "known_acronyms": [
      "ADR",
      "AI",
      "API",
      "CPU",
      "DNS",
      "GB",
      "GPU",
      "HTTP",
      "HTTPS",
      "ID",
      "IP",
      "JSON",
      "MB",
      "RAM",
      "SDK",
      "SQL",
      "TCP",
      "TLS",
      "UI",
      "URL",
      "UTC",
      "UX",
      "VM",
      "XML",
      "YAML"
    ],
    "purpose_markers": {
      "decision": [
        "accept",
        "approval",
        "approve",
        "decide",
        "decision",
        "defer",
        "deferral",
        "reject",
        "rejection",
        "recommend",
        "recommendation",
        "ratification",
        "ratify"
      ],
      "remediation": [
        "address",
        "correct",
        "fix",
        "harden",
        "implement",
        "implementation",
        "mitigate",
        "mitigation",
        "patch",
        "remediate",
        "remediation",
        "repair",
        "remove",
        "removal",
        "replace",
        "resolve",
        "update"
      ],
      "evidence": [
        "confirm",
        "demonstrate",
        "demonstration",
        "evidence",
        "prove",
        "publish",
        "validate",
        "validation",
        "verify",
        "verification"
      ],
      "exit criteria": [
        "after",
        "before",
        "exit criteria",
        "gate",
        "sign off",
        "until",
        "when"
      ]
    },
    "filler_phrases": {
      "purpose filler": [
        "in order to",
        "for purpose of",
        "for the purpose of"
      ],
      "temporal filler": [
        "at this point in time",
        "at this time"
      ],
      "noting filler": [
        "it should be note that"
      ]
    },
    "recommendation_action_groups": {
      "approve": [
        "approve",
        "ratify"
      ],
      "evidence": [
        "document",
        "publish",
        "provide"
      ],
      "fix": [
        "address",
        "fix",
        "mitigate",
        "remediate",
        "resolve"
      ],
      "validate": [
        "check",
        "confirm",
        "test",
        "validate",
        "verify"
      ]
    },
    "qualifiers": [
      "appropriately",
      "basically",
      "clearly",
      "fairly",
      "generally",
      "materially",
      "quite",
      "really",
      "relatively",
      "significantly",
      "somewhat",
      "substantially",
      "very"
    ]
  }
}
